{
  "schema_version": "1.0.0",
  "dataset_name": "exhaustive_skills_batch_java_dotnet_sql_mongo_pg_selenium",
  "generated_at_utc": "2026-03-30T18:30:00Z",
  "skills": [

    {
      "skill": "Java",
      "levels": {
        "Beginner": {
          "Easy": [
            {
              "id": "1",
              "slug": "two-sum",
              "title": "Two Sum",
              "difficulty": "Easy",
              "skill": "Java",
              "skill_level": "Beginner",
              "language": "Java",
              "content": "Given an array of integers nums and an integer target, return indices of the two numbers such that they add up to target.",
              "solution": "Map<Integer,Integer> map = new HashMap<>();\nfor(int i=0;i<nums.length;i++){\n  int c=target-nums[i];\n  if(map.containsKey(c)) return new int[]{map.get(c),i};\n  map.put(nums[i],i);\n}\nthrow new IllegalArgumentException(\"No solution\");",
              "source": "LeetCode",
              "url": "https://leetcode.com/problems/two-sum/"
            },
            {
              "id": "9",
              "slug": "palindrome-number",
              "title": "Palindrome Number",
              "difficulty": "Easy",
              "skill": "Java",
              "skill_level": "Beginner",
              "language": "Java",
              "content": "Given an integer x, return true if x is a palindrome, and false otherwise.",
              "solution": "if(x<0) return false;\nint orig=x, rev=0;\nwhile(x>0){ rev=rev*10+x%10; x/=10; }\nreturn orig==rev;",
              "source": "LeetCode",
              "url": "https://leetcode.com/problems/palindrome-number/"
            },
            {
              "id": "13",
              "slug": "roman-to-integer",
              "title": "Roman to Integer",
              "difficulty": "Easy",
              "skill": "Java",
              "skill_level": "Beginner",
              "language": "Java",
              "content": "Given a roman numeral string s, convert it to an integer.",
              "solution": "Map<Character,Integer> v=Map.of('I',1,'V',5,'X',10,'L',50,'C',100,'D',500,'M',1000);\nint total=0,prev=0;\nfor(char c:s.toCharArray()){\n  int cur=v.get(c);\n  total+=cur>prev?cur-2*prev:cur;\n  prev=cur;\n}\nreturn total;",
              "source": "LeetCode",
              "url": "https://leetcode.com/problems/roman-to-integer/"
            },
            {
              "id": "14",
              "slug": "longest-common-prefix",
              "title": "Longest Common Prefix",
              "difficulty": "Easy",
              "skill": "Java",
              "skill_level": "Beginner",
              "language": "Java",
              "content": "Write a function to find the longest common prefix string amongst an array of strings.",
              "solution": "if(strs.length==0) return \"\";\nfor(int i=0;i<strs[0].length();i++)\n  for(int j=1;j<strs.length;j++)\n    if(i==strs[j].length()||strs[j].charAt(i)!=strs[0].charAt(i))\n      return strs[0].substring(0,i);\nreturn strs[0];",
              "source": "LeetCode",
              "url": "https://leetcode.com/problems/longest-common-prefix/"
            },
            {
              "id": "20",
              "slug": "valid-parentheses",
              "title": "Valid Parentheses",
              "difficulty": "Easy",
              "skill": "Java",
              "skill_level": "Beginner",
              "language": "Java",
              "content": "Given a string s containing just '(', ')', '{', '}', '[' and ']', determine if the input string is valid.",
              "solution": "Stack<Character> st=new Stack<>();\nfor(char c:s.toCharArray()){\n  if(c=='('||c=='['||c=='{') st.push(c);\n  else if(st.isEmpty()) return false;\n  else if(c==')'&&st.pop()!='(') return false;\n  else if(c==']'&&st.pop()!='[') return false;\n  else if(c=='}'&&st.pop()!='{') return false;\n}\nreturn st.isEmpty();",
              "source": "LeetCode",
              "url": "https://leetcode.com/problems/valid-parentheses/"
            },
            {
              "id": "21",
              "slug": "merge-two-sorted-lists",
              "title": "Merge Two Sorted Lists",
              "difficulty": "Easy",
              "skill": "Java",
              "skill_level": "Beginner",
              "language": "Java",
              "content": "Merge two sorted linked lists and return the merged list.",
              "solution": "ListNode dummy=new ListNode(0),cur=dummy;\nwhile(l1!=null&&l2!=null){\n  if(l1.val<=l2.val){cur.next=l1;l1=l1.next;}\n  else{cur.next=l2;l2=l2.next;}\n  cur=cur.next;\n}\ncur.next=(l1!=null)?l1:l2;\nreturn dummy.next;",
              "source": "LeetCode",
              "url": "https://leetcode.com/problems/merge-two-sorted-lists/"
            },
            {
              "id": "J-BEG-E-1",
              "slug": "hello-world-java",
              "title": "Hello World in Java",
              "difficulty": "Easy",
              "skill": "Java",
              "skill_level": "Beginner",
              "language": "Java",
              "content": "Write a Java program that prints 'Hello, World!' to the console.",
              "solution": "public class Main {\n  public static void main(String[] args) {\n    System.out.println(\"Hello, World!\");\n  }\n}",
              "source": "HackerRank",
              "url": "https://www.hackerrank.com/challenges/java-stdin-and-stdout-1"
            },
            {
              "id": "J-BEG-E-2",
              "slug": "java-int-to-string",
              "title": "Convert Integer to String",
              "difficulty": "Easy",
              "skill": "Java",
              "skill_level": "Beginner",
              "language": "Java",
              "content": "Convert integer 42 to a String and print its length.",
              "solution": "int n=42;\nString s=Integer.toString(n);\nSystem.out.println(s.length());",
              "source": "HackerRank",
              "url": "https://www.hackerrank.com/challenges/java-int-to-string"
            }
          ],
          "Medium": [
            {
              "id": "3",
              "slug": "longest-substring-without-repeating",
              "title": "Longest Substring Without Repeating Characters",
              "difficulty": "Medium",
              "skill": "Java",
              "skill_level": "Beginner",
              "language": "Java",
              "content": "Given a string s, find the length of the longest substring without repeating characters.",
              "solution": "int l=0,max=0;\nMap<Character,Integer> map=new HashMap<>();\nfor(int r=0;r<s.length();r++){\n  if(map.containsKey(s.charAt(r)))\n    l=Math.max(l,map.get(s.charAt(r))+1);\n  map.put(s.charAt(r),r);\n  max=Math.max(max,r-l+1);\n}\nreturn max;",
              "source": "LeetCode",
              "url": "https://leetcode.com/problems/longest-substring-without-repeating-characters/"
            },
            {
              "id": "49",
              "slug": "group-anagrams",
              "title": "Group Anagrams",
              "difficulty": "Medium",
              "skill": "Java",
              "skill_level": "Beginner",
              "language": "Java",
              "content": "Given an array of strings strs, group the anagrams together.",
              "solution": "Map<String,List<String>> map=new HashMap<>();\nfor(String s:strs){\n  char[] c=s.toCharArray();\n  Arrays.sort(c);\n  String key=new String(c);\n  map.computeIfAbsent(key,k->new ArrayList<>()).add(s);\n}\nreturn new ArrayList<>(map.values());",
              "source": "LeetCode",
              "url": "https://leetcode.com/problems/group-anagrams/"
            },
            {
              "id": "J-BEG-M-1",
              "slug": "java-arraylist-sort",
              "title": "Sort ArrayList of Custom Objects",
              "difficulty": "Medium",
              "skill": "Java",
              "skill_level": "Beginner",
              "language": "Java",
              "content": "Given a list of Employee objects with name and salary, sort them by salary descending then name ascending.",
              "solution": "list.sort(Comparator.comparingInt(Employee::getSalary).reversed()\n  .thenComparing(Employee::getName));",
              "source": "HackerRank",
              "url": "https://www.hackerrank.com/challenges/java-sort"
            }
          ],
          "Hard": [
            {
              "id": "J-BEG-H-1",
              "slug": "java-regex-email",
              "title": "Validate Email with Regex",
              "difficulty": "Hard",
              "skill": "Java",
              "skill_level": "Beginner",
              "language": "Java",
              "content": "Write a Java method using regex to validate an email address.",
              "solution": "public static boolean isValidEmail(String email){\n  String regex=\"^[a-zA-Z0-9+_.-]+@[a-zA-Z0-9.-]+$\";\n  return email.matches(regex);\n}",
              "source": "HackerRank",
              "url": "https://www.hackerrank.com/challenges/java-regex"
            }
          ]
        },
        "Intermediate_1": {
          "Easy": [
            {
              "id": "206",
              "slug": "reverse-linked-list",
              "title": "Reverse Linked List",
              "difficulty": "Easy",
              "skill": "Java",
              "skill_level": "Intermediate_1",
              "language": "Java",
              "content": "Given the head of a singly linked list, reverse the list and return the reversed list.",
              "solution": "ListNode prev=null,curr=head;\nwhile(curr!=null){\n  ListNode next=curr.next;\n  curr.next=prev;\n  prev=curr;\n  curr=next;\n}\nreturn prev;",
              "source": "LeetCode",
              "url": "https://leetcode.com/problems/reverse-linked-list/"
            },
            {
              "id": "104",
              "slug": "maximum-depth-of-binary-tree",
              "title": "Maximum Depth of Binary Tree",
              "difficulty": "Easy",